{
  "$schema": "http://json-schema.org/draft-04/schema#",
  "id": "http://cpp.moj.gov.uk/hearing/json/schema/event/public.events.hearing.hearing-detail-changed.json",
  "type": "object",
  "properties": {
    "id": {
      "$ref": "http://justice.gov.uk/core/courts/courtsDefinitions.json#/definitions/uuid"
    },
    "type": {
      "$ref": "http://justice.gov.uk/core/courts/hearingType.json"
    },
    "courtCentre": {
      "$ref": "http://justice.gov.uk/core/courts/courtCentre.json"
    },
    "jurisdictionType": {
      "$ref": "http://justice.gov.uk/core/courts/jurisdictionType.json"
    },
    "reportingRestrictionReason": {
      "type": "string"
    },
    "hearingLanguage": {
      "$ref": "http://justice.gov.uk/core/courts/hearingLanguage.json"
    },
    "hearingDays": {
      "type": "array",
      "minItems": 1,
      "items": {
        "$ref": "http://justice.gov.uk/core/courts/hearingDay.json"
      }
    },
    "judiciary": {
      "type": "array",
      "minItems": 1,
      "items": {
        "$ref": "http://justice.gov.uk/core/courts/judicialRole.json"
      }
    }
  }
}
